{
  "id": "next-day-checkin",
  "title": "Starter team checks in the next morning",
  "source": {
    "section": "journey",
    "text": "Of 16 outside people who wrote a first message in the 28 days to 2026-10-27 and were old enough to return, 1 came back on the next Eastern day. 15 of 17 got an agent reply in session one."
  },
  "change": "The morning after a new person's first message, their starter agent posts one check-in that picks up where they left off and offers one next step. Once per person; push where registered.",
  "metric": {
    "label": "New people who come back the next day",
    "numerator": "usage:day1-returned",
    "denominator": "usage:day1-eligible-writers"
  },
  "before": {
    "value": 0.0625,
    "samples": 16,
    "from": "2026-09-30",
    "through": "2026-10-27"
  },
  "predict": {
    "value": 0.25,
    "direction": "up"
  },
  "guardrail": "Starter agents removed or Rooms left by new people do not rise above the 28 days before.",
  "decideAt": {
    "samples": 16,
    "date": "2026-11-25"
  },
  "ifUnclear": "undo",
  "status": "running",
  "approval": {
    "messageId": "cf834fabced4215a83bd7900090a2ec4842e95825a868199d5588b1b4ee1ec00"
  },
  "startedOn": "2026-10-28",
  "progress": null,
  "verdict": null,
  "theme": "loop-hears-only-agents"
}
